{
  "schema_version": "0.1.1",
  "project": {
    "id": "28d83a68-2064-43d7-94cb-72656b9006de",
    "title": "FreeWater",
    "summary": "無料または低価格の水を現場で配布し、将来的に広告・スポンサー収益で成立させる水インフラ実験。",
    "status": "active",
    "created_at": "2026-06-07T12:00:00.000Z",
    "updated_at": "2026-06-07T12:00:00.000Z"
  },
  "goals": [
    {
      "id": "f1111111-1111-4111-8111-111111111111",
      "project_id": "28d83a68-2064-43d7-94cb-72656b9006de",
      "parent_goal_id": null,
      "title": "Phase0 現場検証を完了する",
      "description": "24〜50本程度の水を実際に配り、受け取られ方・怪しさ・続けたいかを確認する。",
      "status": "active",
      "priority": 1,
      "sort_order": 0,
      "created_at": "2026-06-07T12:00:00.000Z",
      "updated_at": "2026-06-07T12:00:00.000Z"
    }
  ],
  "current_state": {
    "id": "f6666666-6666-4666-8666-666666666601",
    "project_id": "28d83a68-2064-43d7-94cb-72656b9006de",
    "primary_goal_id": "f1111111-1111-4111-8111-111111111111",
    "primary_next_action_id": "f3333333-3333-4333-8333-333333333301",
    "summary": "机上設計は一旦完了。今やるべきことは、場所を1つ決め、水2ケースとA4看板で2〜3時間配布し、5分メモを残して翌日Go判断すること。",
    "phase": "phase0_manual_test",
    "confidence": 0.8,
    "updated_at": "2026-06-07T12:00:00.000Z"
  },
  "blockers": [
    {
      "id": "f2222222-2222-4222-8222-222222222201",
      "project_id": "28d83a68-2064-43d7-94cb-72656b9006de",
      "goal_id": "f1111111-1111-4111-8111-111111111111",
      "title": "配布場所が未確定",
      "description": "許可済み、または人がいて問題が起きにくい場所を1つ決める必要がある。",
      "severity": "high",
      "status": "open",
      "created_at": "2026-06-07T12:00:00.000Z",
      "updated_at": "2026-06-07T12:00:00.000Z"
    },
    {
      "id": "f2222222-2222-4222-8222-222222222202",
      "project_id": "28d83a68-2064-43d7-94cb-72656b9006de",
      "goal_id": "f1111111-1111-4111-8111-111111111111",
      "title": "現場反応が未知",
      "description": "無料水が受け取られるか、怪しまれるか、続けたいと思えるかがまだ分からない。",
      "severity": "medium",
      "status": "open",
      "created_at": "2026-06-07T12:00:00.000Z",
      "updated_at": "2026-06-07T12:00:00.000Z"
    }
  ],
  "next_actions": [
    {
      "id": "f3333333-3333-4333-8333-333333333301",
      "project_id": "28d83a68-2064-43d7-94cb-72656b9006de",
      "goal_id": "f1111111-1111-4111-8111-111111111111",
      "blocker_id": "f2222222-2222-4222-8222-222222222201",
      "depends_on_action_id": null,
      "title": "配布場所を1つ決める",
      "description": "許可済み、または人がいる場所を選ぶ。",
      "status": "pending",
      "due_at": null,
      "sort_order": 0,
      "created_at": "2026-06-07T12:00:00.000Z",
      "updated_at": "2026-06-07T12:00:00.000Z"
    },
    {
      "id": "f3333333-3333-4333-8333-333333333302",
      "project_id": "28d83a68-2064-43d7-94cb-72656b9006de",
      "goal_id": "f1111111-1111-4111-8111-111111111111",
      "blocker_id": null,
      "depends_on_action_id": "f3333333-3333-4333-8333-333333333301",
      "title": "水2ケースとA4看板を用意する",
      "description": "最小限の物だけで現場に出る。",
      "status": "pending",
      "due_at": null,
      "sort_order": 1,
      "created_at": "2026-06-07T12:00:00.000Z",
      "updated_at": "2026-06-07T12:00:00.000Z"
    },
    {
      "id": "f3333333-3333-4333-8333-333333333303",
      "project_id": "28d83a68-2064-43d7-94cb-72656b9006de",
      "goal_id": "f1111111-1111-4111-8111-111111111111",
      "blocker_id": "f2222222-2222-4222-8222-222222222202",
      "depends_on_action_id": "f3333333-3333-4333-8333-333333333302",
      "title": "2〜3時間配布して5分メモを残す",
      "description": "受け取り率、怪しさ、声かけ、続けたい感覚を記録する。",
      "status": "pending",
      "due_at": null,
      "sort_order": 2,
      "created_at": "2026-06-07T12:00:00.000Z",
      "updated_at": "2026-06-07T12:00:00.000Z"
    },
    {
      "id": "f3333333-3333-4333-8333-333333333304",
      "project_id": "28d83a68-2064-43d7-94cb-72656b9006de",
      "goal_id": "f1111111-1111-4111-8111-111111111111",
      "blocker_id": null,
      "depends_on_action_id": "f3333333-3333-4333-8333-333333333303",
      "title": "翌日にGo / Stop / 修正を判断する",
      "description": "現場メモを見て Phase0.5 に進むか判断する。",
      "status": "pending",
      "due_at": null,
      "sort_order": 3,
      "created_at": "2026-06-07T12:00:00.000Z",
      "updated_at": "2026-06-07T12:00:00.000Z"
    }
  ],
  "decisions": [
    {
      "id": "f4444444-4444-4444-8444-444444444401",
      "project_id": "28d83a68-2064-43d7-94cb-72656b9006de",
      "goal_id": "f1111111-1111-4111-8111-111111111111",
      "title": "Phase0 は実験ではなく創業者が現場の空気を吸う段階とする",
      "rationale": "数字よりも、受け取られ方・怪しさ・続けたい感覚を確認することが重要なため。",
      "alternatives_considered": [],
      "status": "active",
      "decided_at": "2026-06-07T12:00:00.000Z",
      "created_at": "2026-06-07T12:00:00.000Z",
      "updated_at": "2026-06-07T12:00:00.000Z"
    },
    {
      "id": "f4444444-4444-4444-8444-444444444402",
      "project_id": "28d83a68-2064-43d7-94cb-72656b9006de",
      "goal_id": "f1111111-1111-4111-8111-111111111111",
      "title": "Phase0 ではQRや統計をやらない",
      "rationale": "初回から複雑にすると現場に出るまでの摩擦が増えるため。",
      "alternatives_considered": [],
      "status": "active",
      "decided_at": "2026-06-07T12:00:00.000Z",
      "created_at": "2026-06-07T12:00:00.000Z",
      "updated_at": "2026-06-07T12:00:00.000Z"
    },
    {
      "id": "f4444444-4444-4444-8444-444444444403",
      "project_id": "28d83a68-2064-43d7-94cb-72656b9006de",
      "goal_id": "f1111111-1111-4111-8111-111111111111",
      "title": "Phase0 の予算は 3,000円〜1.5万円程度に抑える",
      "rationale": "継続可否を見極める前に大きく使わないため。",
      "alternatives_considered": [],
      "status": "active",
      "decided_at": "2026-06-07T12:00:00.000Z",
      "created_at": "2026-06-07T12:00:00.000Z",
      "updated_at": "2026-06-07T12:00:00.000Z"
    }
  ],
  "hypotheses": [
    {
      "id": "f5555555-5555-4555-8555-555555555501",
      "project_id": "28d83a68-2064-43d7-94cb-72656b9006de",
      "goal_id": "f1111111-1111-4111-8111-111111111111",
      "statement": "48本程度の無料水配布だけでも、受け取られ方・怪しさ・続けたい感覚は十分に確認できる。",
      "status": "untested",
      "evidence_for": [],
      "evidence_against": [],
      "created_at": "2026-06-07T12:00:00.000Z",
      "updated_at": "2026-06-07T12:00:00.000Z"
    },
    {
      "id": "f5555555-5555-4555-8555-555555555502",
      "project_id": "28d83a68-2064-43d7-94cb-72656b9006de",
      "goal_id": "f1111111-1111-4111-8111-111111111111",
      "statement": "Phase0 では統計よりも創業者の現場感覚の方が重要である。",
      "status": "untested",
      "evidence_for": [],
      "evidence_against": [],
      "created_at": "2026-06-07T12:00:00.000Z",
      "updated_at": "2026-06-07T12:00:00.000Z"
    },
    {
      "id": "f5555555-5555-4555-8555-555555555503",
      "project_id": "28d83a68-2064-43d7-94cb-72656b9006de",
      "goal_id": "f1111111-1111-4111-8111-111111111111",
      "statement": "続けたいと思えたら、Phase0.5 として500本規模・QR・主催者の顔を入れた検証に進む価値がある。",
      "status": "untested",
      "evidence_for": [],
      "evidence_against": [],
      "created_at": "2026-06-07T12:00:00.000Z",
      "updated_at": "2026-06-07T12:00:00.000Z"
    }
  ],
  "reference_docs": [],
  "observations": [
    {
      "id": "f9010101-0101-4101-8101-010101010101",
      "project_id": "28d83a68-2064-43d7-94cb-72656b9006de",
      "goal_id": "f1111111-1111-4111-8111-111111111111",
      "title": "Phase0 実施前メモ",
      "body": "まだ現場配布は未実施。現時点では、場所未確定が最大の実行障害。最初の目的は数字ではなく、無料水が受け取られる空気・怪しさ・続けたい感覚を確認すること。",
      "source": "manual",
      "observed_at": "2026-06-07T12:00:00.000Z",
      "created_at": "2026-06-07T12:00:00.000Z",
      "updated_at": "2026-06-07T12:00:00.000Z"
    },
    {
      "id": "f9010101-0101-4101-8101-010101010102",
      "project_id": "28d83a68-2064-43d7-94cb-72656b9006de",
      "goal_id": "f1111111-1111-4111-8111-111111111111",
      "title": "優先順位の記録",
      "body": "FreeWaterは先に場所を決める",
      "source": "conversation",
      "observed_at": "2026-06-07T12:00:00.000Z",
      "created_at": "2026-06-07T12:00:00.000Z",
      "updated_at": "2026-06-07T12:00:00.000Z"
    }
  ],
  "judgments": [
    {
      "id": "f9020202-0202-4202-8202-020202020202",
      "project_id": "28d83a68-2064-43d7-94cb-72656b9006de",
      "goal_id": "f1111111-1111-4111-8111-111111111111",
      "observation_id": "f9010101-0101-4101-8101-010101010101",
      "title": "Phase0 は実施前なので hold",
      "outcome": "hold",
      "rationale": "現場観測がまだないため Go / Stop / Revise は判断しない。まず primary_next_action と Action chain を明示し、実行可能な状態にする。",
      "decided_at": "2026-06-07T12:00:00.000Z",
      "created_at": "2026-06-07T12:00:00.000Z",
      "updated_at": "2026-06-07T12:00:00.000Z"
    }
  ],
  "goal_edges": [],
  "extensions": {},
  "updated_at": "2026-06-07T12:00:00.000Z"
}
